title,author,refer
How to extract data from a website?,By Sarah Lang,https://www.zyte.com/blog/how-to-extract-data-from-a-website/
How to extract data from a website?,By Sarah Lang,https://www.zyte.com/blog/how-to-extract-data-from-a-website/
Zyte Developers Community newsletter issue #8,By Zyte team,https://www.zyte.com/blog/zyte-developers-community-newsletter-issue-8/
Scale up your Scrapy projects with Smart Proxy Manager,By John Campbell,https://www.zyte.com/blog/scale-up-your-scrapy-projects-with-zyte-smart-proxy-manager-formerly-crawlera/
Zyte Developers Community newsletter issue #7,By Zyte team,https://www.zyte.com/blog/zyte-developers-community-newsletter-issue-7/
Van Buren: A victory for web scrapers,By Victoria Vlahoyiannis,https://www.zyte.com/blog/van-buren-a-victory-for-web-scrapers/
Zyte Developers Community newsletter issue #6,By Zyte team,https://www.zyte.com/blog/zyte-developers-community-newsletter-issue-6/
How web data can help fuel your dynamic pricing strategy,By Himanshi Bhatt,https://www.zyte.com/blog/how-web-data-can-fuel-your-dynamic-pricing-strategy/
Zyte Developers Community newsletter issue #5,By Zyte team,https://www.zyte.com/blog/zyte-developers-community-newsletter-issue-5/
Extract JSONs like a pro with chompjs and JMESPath,By Roy Healy,https://www.zyte.com/blog/extract-json-using-chompjs-and-jmespath/
Extracting article & news data: The importance of data quality,By Alexandra Harris,https://www.zyte.com/blog/news-api-blog-importance-of-article-quality/
How to extract data from a website?,By Sarah Lang,https://www.zyte.com/blog/how-to-extract-data-from-a-website/
Zyte Developers Community newsletter issue #4,By Attila Toth,https://www.zyte.com/blog/zyte-developers-community-newsletter-issue-4/
Extract Summit 2021 - come join the web data revolution,By Marie Moynihan,https://www.zyte.com/blog/extract-summit-2021-come-join-the-web-data-revolution/
Alternative data for hedge funds & portfolio management,By John Campbell,https://www.zyte.com/blog/alternative-data-for-hedge-funds-portfolio-management/
The importance of web data and how to easily access it,By Alexandra Harris,https://www.zyte.com/blog/the-importance-of-web-data-and-how-to-easily-access-it/
Dateparser: A little but powerful date parsing library,By Marc Hernandez Cabot,https://www.zyte.com/blog/dateparser-a-powerful-date-parsing-library/
Zyte Developers Community newsletter issue #3,By Attila Toth,https://www.zyte.com/blog/zyte-developers-community-newsletter-issue-3/
Zyte Developers Community newsletter issue #2,By Attila Toth,https://www.zyte.com/blog/zyte-developers-community-newsletter-issue-2/
Zyte Developers Community newsletter issue #1,By Attila Toth,https://www.zyte.com/blog/zyte-developers-community-newsletter-issue-1/
Insurance & credit scoring with alternative data,By John Campbell,https://www.zyte.com/blog/insurance-credit-scoring-enhanced-with-alternative-data/
Launching the Zyte Developers Community,By Attila Toth,https://www.zyte.com/blog/launching-the-zyte-developers-community/
How to extract data from a website?,By Sarah Lang,https://www.zyte.com/blog/how-to-extract-data-from-a-website/
Automatic Extraction: Better web data with less hassle,By Alexandra Harris,https://www.zyte.com/blog/automatic-extraction-data-extractor-review/
Scrapy update: Better broad crawl performance,By Nikita Vostretsov,https://www.zyte.com/blog/scrapy-update-better-broad-crawl-performance/
"Hi, we’re Zyte!",By Shane Evans,https://www.zyte.com/blog/scrapinghub-is-now-zyte/
Irish data extraction innovator unveils new name – and new AI-powered Automatic Extraction service,By Zyte team,https://www.zyte.com/blog/press-release-scrapinghub-is-now-zyte/
Large scale web scraping,By Attila Toth,https://www.zyte.com/blog/large-scale-web-scraping/
Announcing The Web Data Extraction Summit 2020,By Himanshi Bhatt,https://www.zyte.com/blog/announcing-the-web-data-extraction-summit-2020/
A practical guide to web data QA part V: Broad crawls,By Ivan Ivanov,https://www.zyte.com/blog/a-practical-guide-to-web-data-qa-part-v-broad-crawls/
Announcing the Web Data Extraction Summit 2020,By Himanshi Bhatt,https://www.zyte.com/blog/web-data-extraction-summit-2020/
News & article data extraction: Open source vs closed source solutions,By Attila Toth,https://www.zyte.com/blog/news-article-data-extraction-open-source-vs-closed-source-solutions/
A practical guide to web data QA part IV: Complementing semi-automated techniques,By Ivan Ivanov,https://www.zyte.com/blog/a-practical-guide-to-web-data-qa-part-iv-complementing-semi-automated-techniques/
How to extract data from a website?,By Sarah Lang,https://www.zyte.com/blog/how-to-extract-data-from-a-website/
Real estate: Use web data extraction to make smarter decisions,By Attila Toth,https://www.zyte.com/blog/web-scraping-real-estate-data-use-cases/
Scrapy Cloud secrets: Hub Crawl Frontier and how to use it,By Julio Cesar Batista,https://www.zyte.com/blog/scrapy-cloud-secrets-hub-crawl-frontier-and-how-to-use-it/
Blog comments API (BETA): Extract blog comment data at scale,By John Campbell,https://www.zyte.com/blog/blog-comments-api-beta-release/
Your price intelligence questions answered,By Himanshi Bhatt,https://www.zyte.com/blog/price-intelligence-questions-answered/
Data center proxies vs. residential proxies,By Attila Toth,https://www.zyte.com/blog/data-center-proxies-vs-residential-proxies/
How to get high success rates with proxies: 3 steps to scale up,By Attila Toth,https://www.zyte.com/blog/how-to-get-high-success-rates-with-proxies-3-steps-to-scale-up/
Zyte Automatic Extraction job postings API: Stable release,By John Campbell,https://www.zyte.com/blog/job-postings-api-stable-release/
Web scraping basics: A developer’s guide to reliably extract data,By Attila Toth,https://www.zyte.com/blog/web-scraping-basics-tools/
Price gouging or economics at work: Price intelligence to track consumer sentiment,By Robert Cosgrave,https://www.zyte.com/blog/price-gouging-or-economics-at-work-price-intelligence-to-track-consumer-sentiment/
A practical guide to web data QA part III: Holistic data validation techniques,By Ivan Ivanov,https://www.zyte.com/blog/web-data-qa-part-iii-combining-manual-and-automated-techniques-for-holistic-data-validation/
How to extract data from a website?,By Sarah Lang,https://www.zyte.com/blog/how-to-extract-data-from-a-website/
Product reviews API (beta): Extract product reviews at scale,By Attila Toth,https://www.zyte.com/blog/product-reviews-api-beta-extract-product-reviews-at-scale/
Custom crawling & News API: designing a web scraping solution,By Julio Cesar Batista,https://www.zyte.com/blog/extract-articles-at-scale-designing-a-web-scraping-solution/
Vehicle API (beta): Extract automotive data at scale,By Attila Toth,https://www.zyte.com/blog/vehicle-api-launch/
A practical guide to web data extraction QA part II: Common validation pitfalls,By Ivan Ivanov,https://www.zyte.com/blog/web-data-qa-common-validation-pitfalls/
Transitioning to remote working as a company,By Shane Evans,https://www.zyte.com/blog/transitioning-to-remote-working-as-a-company/
A practical guide to web data QA part I: Validation techniques,By Ivan Ivanov,https://www.zyte.com/blog/guide-to-web-data-extraction-qa-validation-techniques/
COVID-19: Handling the situation as a fully remote company,By Suzanne Hassett,https://www.zyte.com/blog/covid-19-handling-the-situation-as-a-fully-remote-company/
Extracting clean article HTML with news API,By Ivan de Prado Alonso,https://www.zyte.com/blog/extracting-clean-article-html-with-autoextract/
Job postings beta API: Extract job postings at scale,By Attila Toth,https://www.zyte.com/blog/job-postings-at-scale-beta-api/
Building spiders made easy: GUI for your Scrapy shell,By Roy Healy,https://www.zyte.com/blog/building-spiders-made-easy-gui-for-your-scrapy-shell/
How to extract data from a website?,By Sarah Lang,https://www.zyte.com/blog/how-to-extract-data-from-a-website/
How to scrape the web without getting blocked,By Attila Toth,https://www.zyte.com/blog/how-to-scrape-the-web-without-getting-blocked/
News web data extraction to predict Irish election results,By Cristi Constantin,https://www.zyte.com/blog/news-web-data-extraction-to-predict-irish-election-results/
Introducing Zyte Smart Proxy Manager (formerly Crawlera) — free trials & new plans,By Pablo Hoffman,https://www.zyte.com/blog/introducing-zyte-smart-proxy-manager-crawlera-free-trials-new-plans/
Best recruitment tips: How to scout top talent,By Eric Burke,https://www.zyte.com/blog/recruitment-tips-to-find-top-talent/
Looking back at 2019,By Attila Toth,https://www.zyte.com/blog/looking-back-at-2019/
How to use a proxy in Puppeteer,By Attila Toth,https://www.zyte.com/blog/how-to-use-a-proxy-in-puppeteer/
How to leverage alternative data in asset management,By Marie Moynihan,https://www.zyte.com/blog/how-to-leverage-alternative-data-in-asset-management/
Backconnect proxy: Explanation & comparison to other proxies,By Zyte team,https://www.zyte.com/blog/backconnect-proxy/
4 sectors that benefited most from business intelligence software,By Zyte team,https://www.zyte.com/blog/4-sectors-that-benefited-most-from-business-intelligence-software/
Price scraping: The best free tool to scrape prices,By Zyte team,https://www.zyte.com/blog/price-scraping-best-free-tool-to-scrape-prices/
How to extract data from a website?,By Sarah Lang,https://www.zyte.com/blog/how-to-extract-data-from-a-website/
How to use Zyte Smart Proxy Manager (formerly Crawlera) with Scrapy,By Zyte team,https://www.zyte.com/blog/how-to-use-zyte-smart-proxy-manager-with-scrapy/
"Scrapy, Matplotlib, and MySQL: Real estate data analysis",By Zyte team,https://www.zyte.com/blog/scrapy-matplotlib-and-mysql-real-estate-data-analysis/
Web scraping questions & answers part II,By Zyte team,https://www.zyte.com/blog/web-scraping-questions-answers-part-2/
Scrapy & Zyte Automatic Extraction API integration,By Zyte team,https://www.zyte.com/blog/scrapy-autoextract-api-integration/
Web scraping questions & answers part I,By Zyte team,https://www.zyte.com/blog/web-scraping-questions-answers-part-1/
"Price intelligence with Python: Scrapy, SQL, and Pandas",By Zyte team,https://www.zyte.com/blog/price-intelligence-with-python-scrapy-sql-pandas/
The Web Data Extraction Summit 2019,By Zyte team,https://www.zyte.com/blog/the-web-data-extraction-summit-2019/
News data extraction at scale with AI-powered Zyte Automatic Extraction,By Zyte team,https://www.zyte.com/blog/news-data-extraction-at-scale-with-ai-powered-autoextract/
Gain a competitive edge with product data,By Zyte team,https://www.zyte.com/blog/gain-a-competitive-edge-with-product-data/
Four use cases for online public sentiment data,By Zyte team,https://www.zyte.com/blog/use-cases-for-online-public-sentiment-data/
How to extract data from a website?,By Sarah Lang,https://www.zyte.com/blog/how-to-extract-data-from-a-website/
The first-ever Web Data Extraction Summit!,By Zyte team,https://www.zyte.com/blog/the-first-web-data-extraction-summit/
Learn how to configure and utilize proxies with Python requests module,By Attila Toth,https://www.zyte.com/blog/python-requests-proxy/
How to set up a custom proxy in Scrapy?,By Zyte team,https://www.zyte.com/blog/scrapy-proxy/
GDPR update: Scraping public personal data,By Zyte team,https://www.zyte.com/blog/gdpr-public-personal-data-update/
Solution architecture part 5: Designing a well-optimized web scraping solution,By Colm Kenny,https://www.zyte.com/blog/solution-architecture-part-5-designing-a-solution-estimating-resource-requirements/
Solution architecture part 4: Accessing the technical feasibility of your web scraping project,By Colm Kenny,https://www.zyte.com/blog/solution-architecture-part-4-accessing-the-technical-feasibility-of-your-web-scraping-project/
Visual web scraping tools: What to do when they are no longer fit for purpose?,By Zyte team,https://www.zyte.com/blog/visual-web-scraping-tools-what-to-do-when-they-are-no-longer-fit-for-purpose/
Solution architecture part 3: Conducting a web scraping legal review,By Sanaea Daruwalla,https://www.zyte.com/blog/solution-architecture-part-3-conducting-a-web-scraping-legal-review/
ScrapyRT: Turn websites into real-time APIs,By Zyte team,https://www.zyte.com/blog/scrapyrt-turn-websites-into-real-time-apis/
Web data analysis: Exposing NFL player salaries with Python,By Zyte team,https://www.zyte.com/blog/web-data-analysis-exposing-nfl-player-salaries-with-python/
How to extract data from a website?,By Sarah Lang,https://www.zyte.com/blog/how-to-extract-data-from-a-website/
From the creators of Scrapy: Artificial intelligence data extraction API,By Zyte team,https://www.zyte.com/blog/artificial-intelligence-data-extraction-api/
Zyte’s (formerly Scrapinghub) new AI-powered Automatic Extraction API for e-commerce & article extraction,By Zyte team,https://www.zyte.com/blog/developer-data-extraction-api-for-product-article-extraction/
Solution architecture part 2: How to define the scope of your web scraping project,By Colm Kenny,https://www.zyte.com/blog/web-scraping-requirement-gathering/
Navigating compliance when extracting web scraped alternative data for finance,By Zyte team,https://www.zyte.com/blog/regulatory-compliance-for-alternative-web-scraped-financial-data/
St Patrick’s day special: Finding Dublin’s best pint of Guinness with web scraping,By Zyte team,https://www.zyte.com/blog/web-scraping-best-pint-of-guinness-dublin/
Spidermon: Zyte's (formerly Scrapinghub) secret sauce to our data quality & reliability guarantee,By Zyte team,https://www.zyte.com/blog/spidermon-the-secret-sauce-to-our-data-quality-guarantee/
Meet Spidermon: Zyte's (formerly Scrapinghub) battle-tested spider monitoring library [now open-sourced],By Zyte team,https://www.zyte.com/blog/spidermon-scrapy-spider-monitoring/
Proxy management: Should I build my proxy infrastructure in-house or use an off-the-shelf proxy solution?,By Zyte team,https://www.zyte.com/blog/best-web-scraping-proxy-management-solution/
A sneak peek inside Zyte Smart Proxy Manager (formerly Crawlera): The world’s smartest web scraping proxy network,By Zyte team,https://www.zyte.com/blog/sneak-peek-inside-zyte-smart-proxy-manager-crawlera/
Why we created Zyte Smart Proxy Manager (formerly Crawlera)?,By Zyte team,https://www.zyte.com/blog/the-zyte-smart-proxy-manager-crawlera-story/
How to extract data from a website?,By Sarah Lang,https://www.zyte.com/blog/how-to-extract-data-from-a-website/
The rise of web data in hedge fund decision making & the importance of data quality,By Zyte team,https://www.zyte.com/blog/alternative-financial-data-quality/
The predictive power of web scraped product data for institutional investors: A GoPro case study,By Zyte team,https://www.zyte.com/blog/gopro-study/
The challenges e-commerce retailers face managing their web scraping proxies,By Zyte team,https://www.zyte.com/blog/challenges-enterprise-ecommerce-web-scraping-proxies/
Looking back at 2018,By Zyte team,https://www.zyte.com/blog/looking-back-at-2018/
Do what is right not what is easy!,By Zyte team,https://www.zyte.com/blog/gdpr-web-scraping-iiap-europe-data-protection-congress/
Shubber GetTogether 2018,By Zyte team,https://www.zyte.com/blog/shubber-gettogether-2018/
Data quality assurance for enterprise web scraping,By Zyte team,https://www.zyte.com/blog/data-quality-assurance-for-enterprise-web-scraping/
What I learned as a Google Summer of Code student at Zyte (formerly Scrapinghub),By Zyte team,https://www.zyte.com/blog/what-i-learned-as-a-google-summer-of-code-student-at-zyte/
GDPR compliance for web scrapers: The step-by-step guide,By Zyte team,https://www.zyte.com/blog/web-scraping-gdpr-compliance-guide/
Data for price intelligence: Lessons learned scraping 100 billion products pages,By Zyte team,https://www.zyte.com/blog/price-intelligence-web-scraping-at-scale-100-billion-products/
How to extract data from a website?,By Sarah Lang,https://www.zyte.com/blog/how-to-extract-data-from-a-website/
A sneak peek inside what hedge funds think of alternative financial data,By Zyte team,https://www.zyte.com/blog/a-sneak-peek-inside-what-hedge-funds-think-of-alternative-financial-data/
Want to predict Fitbit’s quarterly revenue? Eagle Alpha did it using web scraped product data,By Zyte team,https://www.zyte.com/blog/fitbit-quarterly-revenue-web-scraped-product-data/
How data compliance companies are turning to web crawlers to take advantage of the GDPR business opportunity,By Zyte team,https://www.zyte.com/blog/gdpr-compliance-tools-web-scraping-crawlers/
Looking back at 2017,By Zyte team,https://www.zyte.com/blog/looking-back-at-2017/
"A faster, updated Scrapinghub (now Zyte)",By Zyte team,https://www.zyte.com/blog/a-faster-updated-scrapinghub-now-zyte/
Scraping the Steam game store with Scrapy,By Zyte team,https://www.zyte.com/blog/scraping-the-steam-game-store-with-scrapy/
Do Androids dream of electric sheep?,By Zyte team,https://www.zyte.com/blog/do-androids-dream-of-electric-sheep/
Deploy your Scrapy spiders from GitHub,By Zyte team,https://www.zyte.com/blog/deploy-your-scrapy-spiders-from-github/
Looking back at 2016,By Zyte team,https://www.zyte.com/blog/looking-back-at-2016/
How to increase sales with online reputation management,By Zyte team,https://www.zyte.com/blog/how-to-increase-sales-with-online-reputation-management/
How to extract data from a website?,By Sarah Lang,https://www.zyte.com/blog/how-to-extract-data-from-a-website/
How to build your own price monitoring tool,By Zyte team,https://www.zyte.com/blog/how-to-build-your-own-price-monitoring-tool/
How you can use web data to accelerate your startup,By Zyte team,https://www.zyte.com/blog/how-you-can-use-web-data-to-accelerate-your-startup/
An introduction to XPath: How to get started,By Zyte team,https://www.zyte.com/blog/an-introduction-to-xpath-with-examples/
Why promoting open data increases economic opportunities,By Zyte team,https://www.zyte.com/blog/why-promoting-open-data-increases-economic-opportunities/
Interview: How Up Hail uses Scrapy to increase transparency,By Zyte team,https://www.zyte.com/blog/interview-how-up-hail-uses-scrapy-to-increase-transparency/
How to run Python scripts in Scrapy Cloud,By Zyte team,https://www.zyte.com/blog/how-to-run-python-scripts-in-scrapy-cloud/
Embracing the future of work: How to communicate remotely,By Zyte team,https://www.zyte.com/blog/embracing-the-future-of-work-how-to-communicate-remotely/
How to deploy custom docker images for your web crawlers,By Zyte team,https://www.zyte.com/blog/how-to-deploy-custom-docker-images-for-your-web-crawlers/
Improved Frontera: Web crawling at scale with Python 3 support,By Zyte team,https://www.zyte.com/blog/improved-frontera-web-crawling-at-scale-with-python-3-support/
How to crawl the web politely with Scrapy,By Zyte team,https://www.zyte.com/blog/how-to-crawl-the-web-politely-with-scrapy/
How to extract data from a website?,By Sarah Lang,https://www.zyte.com/blog/how-to-extract-data-from-a-website/
Introducing Scrapy Cloud with Python 3 support,By Zyte team,https://www.zyte.com/blog/introducing-scrapy-cloud-with-python-3-support/
What the Suicide Squad tells us about web data,By Zyte team,https://www.zyte.com/blog/what-the-suicide-squad-tells-us-about-web-data/
This month in open source at Scrapinghub (now Zyte) August 2016,By Zyte team,https://www.zyte.com/blog/this-month-in-open-source-at-scrapinghub-now-zyte-august-2016/
Meet Parsel: The selector library behind Scrapy,By Zyte team,https://www.zyte.com/blog/meet-parsel-the-selector-library-behind-scrapy/
Incremental crawls with Scrapy and DeltaFetch,By Zyte team,https://www.zyte.com/blog/scrapy-tips-from-the-pros-july-2016/
Improving access to Peruvian Congress bills with Scrapy,By Zyte team,https://www.zyte.com/blog/improving-access-to-peruvian-congress-bills-with-scrapy/
Scrapely: The brains behind Portia spiders,By Zyte team,https://www.zyte.com/blog/scrapely-the-brains-behind-portia-spiders/
Introducing Portia2Code: Portia projects into Scrapy spiders,By Zyte team,https://www.zyte.com/blog/introducing-portia2code-portia-projects-into-scrapy-spiders/
Scraping infinite scrolling pages,By Zyte team,https://www.zyte.com/blog/scrapy-tips-from-the-pros-june-2016/
This month in open source at Scrapinghub June 2016,By Zyte team,https://www.zyte.com/blog/this-month-in-open-source-at-scrapinghub-now-zyte-june-2016/
How to extract data from a website?,By Sarah Lang,https://www.zyte.com/blog/how-to-extract-data-from-a-website/
Introducing the Datasets catalog,By Zyte team,https://www.zyte.com/blog/introducing-the-datasets-catalog/
Introducing the Zyte Smart Proxy Manager (formerly Crawlera) dashboard,By Zyte team,https://www.zyte.com/blog/introducing-zyte-smart-proxy-manager-crawlera-dashboard/
Data extraction with Scrapy and Python 3,By Zyte team,https://www.zyte.com/blog/data-extraction-with-scrapy-and-python/
How to debug your Scrapy spiders,By Zyte team,https://www.zyte.com/blog/scrapy-tips-from-the-pros-may-2016-edition/
Scrapy + MonkeyLearn: Textual analysis of web data,By Zyte team,https://www.zyte.com/blog/monkeylearn-addon-retail-classifier-tutorial/
Introducing Scrapy Cloud 2.0,By Zyte team,https://www.zyte.com/blog/introducing-scrapy-cloud-2-0/
A (not so) short story on getting decent internet access,By Zyte team,https://www.zyte.com/blog/a-not-so-short-story-on-getting-decent-internet-access/
Scraping websites based on ViewStates with Scrapy,By Zyte team,https://www.zyte.com/blog/scrapy-tips-from-the-pros-april-2016-edition/
Machine learning with web scraping: New MonkeyLearn addon,By Zyte team,https://www.zyte.com/blog/grow-your-data-with-monkeylearn-addon/
Mapping corruption in the Panama papers with open data,By Zyte team,https://www.zyte.com/blog/how-to-become-a-whistleblower-from-panama-papers-to-open-data/
How to extract data from a website?,By Sarah Lang,https://www.zyte.com/blog/how-to-extract-data-from-a-website/
Web scraping to create open data,By Zyte team,https://www.zyte.com/blog/web-scraping-to-create-open-data/
Scrapy tips from the pros: March 2016 edition,By Zyte team,https://www.zyte.com/blog/scrapy-tips-from-the-pros-march-2016-edition/
This month in open source at Scrapinghub (now Zyte) March 2016,By Zyte team,https://www.zyte.com/blog/this-month-in-open-source-at-scrapinghub-now-zyte-march-2016/
Join Scrapinghub for Google Summer of Code 2016,By Zyte team,https://www.zyte.com/blog/join-scrapinghub-now-zyte-for-google-summer-of-code-2016/
How web scraping is revealing lobbying and corruption in Peru,By Zyte team,https://www.zyte.com/blog/how-web-scraping-is-revealing-lobbying-and-corruption-in-peru/
Splash 2.0 is here with Qt 5 and Python 3,By Zyte team,https://www.zyte.com/blog/splash-2-0-here-with-qt-5-and-python-3/
Migrate your Kimono projects to Portia,By Zyte team,https://www.zyte.com/blog/migrate-your-kimono-projects-to-portia/
Scrapy tips from the pros: February 2016 edition,By Zyte team,https://www.zyte.com/blog/scrapy-tips-from-the-pros-february-2016-edition/
Portia: The open-source alternative to Kimono labs,By Zyte team,https://www.zyte.com/blog/portia-alternative-to-kimono/
Web scraping finds stores guilty of price inflation,By Zyte team,https://www.zyte.com/blog/which-stores-are-guilty-of-price-inflation/
How to extract data from a website?,By Sarah Lang,https://www.zyte.com/blog/how-to-extract-data-from-a-website/
Python 3 is coming to Scrapy,By Zyte team,https://www.zyte.com/blog/python-3-support-with-scrapy-1/
Happy anniversary: Zyte (formerly Scrapinghub) turns 5,By Zyte team,https://www.zyte.com/blog/happy-anniversary-scrapinghub-now-zyte-turns-5/
Scrapy tips from the pros: part 1,By Zyte team,https://www.zyte.com/blog/scrapy-tips-from-the-pros-part-1/
Vizlegal: Rise of machine-readable laws and court judgments,By Zyte team,https://www.zyte.com/blog/vizlegal-rise-of-machine-readable-laws-and-court-judgments/
Christmas eve vs new year's eve: Last-minute price inflation?,By Zyte team,https://www.zyte.com/blog/christmas-eve-vs-new-years-eve-last-minute-price-inflation/
Looking back at 2015,By Zyte team,https://www.zyte.com/blog/looking-back-at-2015/
Winter sales showdown: Black Friday vs Cyber Monday vs Green Monday,By Zyte team,https://www.zyte.com/blog/winter-sales-showdown-black-friday-vs-cyber-monday-vs-green-monday/
Chats with RINAR Solutions,By Zyte team,https://www.zyte.com/blog/chats-with-rinar-solutions/
"Black Friday, Cyber Monday: Are they worth it?",By Zyte team,https://www.zyte.com/blog/black-friday-cyber-monday-are-they-worth-it/
Tips for creating a cohesive company culture remotely,By Zyte team,https://www.zyte.com/blog/tips-for-creating-a-cohesive-company-culture-remotely/
How to extract data from a website?,By Sarah Lang,https://www.zyte.com/blog/how-to-extract-data-from-a-website/
Parse natural language dates with Dateparser,By Zyte team,https://www.zyte.com/blog/parse-natural-language-dates-with-dateparser/
Aduana: Link analysis to crawl the web at scale,By Zyte team,https://www.zyte.com/blog/aduana-link-analysis-to-crawl-the-web-at-scale/
Scrapy on the road to Python 3 support,By Zyte team,https://www.zyte.com/blog/scrapy-on-the-road-to-python-3-support/
Introducing Javascript support for Portia,By Zyte team,https://www.zyte.com/blog/introducing-javascript-support-for-portia/
Distributed Frontera: Web crawling at scale,By Zyte team,https://www.zyte.com/blog/distributed-frontera-web-crawling-at-large-scale/
The road to loading JavaScript in Portia,By Zyte team,https://www.zyte.com/blog/the-road-to-loading-javascript-in-portia/
EuroPython 2015,By Zyte team,https://www.zyte.com/blog/europython-2015/
StartupChats remote working Q&A,By Zyte team,https://www.zyte.com/blog/startupchats-remote-working/
PyCon Philippines 2015,By Zyte team,https://www.zyte.com/blog/pycon-philippines-2015/
Google Summer of Code 2015,By Zyte team,https://www.zyte.com/blog/google-summer-of-code-2015/
