title,author,refer
How to extract data from a website?,By Sarah Lang,https://www.zyte.com/blog/how-to-extract-data-from-a-website/
Link analysis algorithms explained,By Zyte team,https://www.zyte.com/blog/link-analysis-algorithms-explained/
"EuroPython, here we go!",By Zyte team,https://www.zyte.com/blog/europython-here-we-go/
Aduana: Link analysis with Frontera,By Zyte team,https://www.zyte.com/blog/aduana-link-analysis-with-frontera/
Using git to manage vacations in a large distributed team,By Zyte team,https://www.zyte.com/blog/git-for-managing-vacations/
Gender inequality across programming languages,By Zyte team,https://www.zyte.com/blog/gender-inequality-across-programming-languages/
Traveling tips for remote workers,By Zyte team,https://www.zyte.com/blog/traveling-tips-for-remote-workers/
A career in remote working,By Zyte team,https://www.zyte.com/blog/a-career-in-remote-working/
Frontera: The brain behind the crawls,By Zyte team,https://www.zyte.com/blog/frontera-the-brain-behind-the-crawls/
Scrape data visually with Portia and Scrapy Cloud,By Zyte team,https://www.zyte.com/blog/scrape-data-visually-with-portia-and-scrapy-cloud/
Zyte (formerly Scrapinghub): A remote working success story,By Zyte team,https://www.zyte.com/blog/scrapinghub-now-zyte-remote-working-success-story/
How to extract data from a website?,By Sarah Lang,https://www.zyte.com/blog/how-to-extract-data-from-a-website/
Why we moved to Slack,By Zyte team,https://www.zyte.com/blog/why-we-moved-to-slack/
The history of Scrapinghub,By Zyte team,https://www.zyte.com/blog/history-of-zyte-formerly-scrapinghub/
Skinfer: A tool for inferring JSON schemas,By Zyte team,https://www.zyte.com/blog/skinfer-a-tool-for-inferring-json-schemas/
Handling JavaScript in Scrapy with Splash,By Zyte team,https://www.zyte.com/blog/handling-javascript-in-scrapy-with-splash/
Scrapinghub (now Zyte) crawls the deep web,By Zyte team,https://www.zyte.com/blog/memex/
New changes to our Scrapy cloud platform,By Zyte team,https://www.zyte.com/blog/new-changes-to-our-scrapy-cloud-platform/
Introducing ScrapyRT: An API for Scrapy spiders,By Zyte team,https://www.zyte.com/blog/introducing-scrapyrt-an-api-for-scrapy-spiders/
Looking back at 2014,By Zyte team,https://www.zyte.com/blog/looking-back-at-2014/
XPath tips from the web scraping trenches,By Zyte team,https://www.zyte.com/blog/xpath-tips-from-the-web-scraping-trenches/
Introducing data reviews,By Zyte team,https://www.zyte.com/blog/introducing-data-reviews/
How to extract data from a website?,By Sarah Lang,https://www.zyte.com/blog/how-to-extract-data-from-a-website/
Extracting schema.org microdata using Scrapy selectors and XPath,By Zyte team,https://www.zyte.com/blog/extracting-schema-org-microdata-using-scrapy-selectors-and-xpath/
"Announcing Portia, the open-source visual web scraper!",By Zyte team,https://www.zyte.com/blog/announcing-portia/
Optimizing memory usage of Scikit-Learn models using succinct tries,By Zyte team,https://www.zyte.com/blog/optimizing-memory-usage-of-scikit-learn-models-using-succinct-tries/
Open source at Zyte,By Zyte team,https://www.zyte.com/blog/open-source-at-scrapinghub-now-zyte/
Looking back at 2013,By Zyte team,https://www.zyte.com/blog/looking-back-at-2013/
Marcos Campal is a ScrapingHubber!,By Zyte team,https://www.zyte.com/blog/marcos-campal-is-a-scrapinghubber/
Introducing Dash,By Zyte team,https://www.zyte.com/blog/introducing-dash/
Why MongoDB is a bad choice for storing our scraped data,By Zyte team,https://www.zyte.com/blog/mongo-bad-for-scraped-data/
"Introducing Crawlera (now Zyte Smart Proxy Manager), a smart page downloader",By Zyte team,https://www.zyte.com/blog/introducing-crawlera-now-zyte-smart-proxy-manager/
Git workflow for Scrapy projects,By Zyte team,https://www.zyte.com/blog/git-workflow-scrapy-projects/
How to extract data from a website?,By Sarah Lang,https://www.zyte.com/blog/how-to-extract-data-from-a-website/
How to fill login forms automatically,By Zyte team,https://www.zyte.com/blog/filling-login-forms-automatically/
Spiders activity graphs,By Kevin McKinless,https://www.zyte.com/blog/spiders-activity-graphs/
Finding similar items,By Kevin McKinless,https://www.zyte.com/blog/finding-similar-items/
Scrapy 0.15 dropping support for Python 2.5,By Kevin McKinless,https://www.zyte.com/blog/scrapy-0-15-dropping-support-for-python-2-5/
Autoscraping casts a wider net,By Kevin McKinless,https://www.zyte.com/blog/autoscraping-casts-a-wider-net/
Scrapy 0.14 released,By Kevin McKinless,https://www.zyte.com/blog/scrapy-0-14-released/
Dirbot: A new example Scrapy project,By Kevin McKinless,https://www.zyte.com/blog/dirbot-a-new-example-scrapy-project/
Introducing w3lib and scrapely,By Kevin McKinless,https://www.zyte.com/blog/introducing-w3lib-and-scrapely/
Scrapy 0.12 released,By Kevin McKinless,https://www.zyte.com/blog/scrapy-0-12-released/
Spoofing your Scrapy bot IP using tsocks,By Kevin McKinless,https://www.zyte.com/blog/scrapy-tsocks/
How to extract data from a website?,By Sarah Lang,https://www.zyte.com/blog/how-to-extract-data-from-a-website/
"Hello, world",By Kevin McKinless,https://www.zyte.com/blog/hello-world/
